天気環境ID,天気環境名,説明,リスクレベル,安全スコア補正値,優先度スコア,トラブル緊急度補正,備考
WEATHER_001,晴れ,良好な視界、路面乾燥,低,0.00,0.00,0.9,通常の運転が可能
WEATHER_002,曇り,やや視界不良、路面乾燥,低,-0.05,0.02,1.0,夕方は視認性低下
WEATHER_003,雨,視界不良、路面濡れ,中,-0.15,0.08,1.1,スリップ注意、運転支援機能の価値が高まる
WEATHER_004,大雨,視界著しく不良、路面冠水リスク,高,-0.25,0.15,1.3,速度抑制推奨、運転支援機能が重要
WEATHER_005,雪,視界不良、路面凍結,高,-0.30,0.20,1.2,スタッドレス必須、運転支援+暖房機能が重要
WEATHER_006,大雪,視界著しく不良、路面凍結,最高,-0.40,0.25,1.4,運転支援+暖房機能が最重要
WEATHER_007,霧,視界著しく不良,高,-0.25,0.15,1.1,前照灯・霧灯使用、視認支援機能が重要
WEATHER_008,強風,横風の影響,中,-0.10,0.08,1.0,車線維持支援が有効
